{
  "$schema": "https://json-schema.org/draft/2020-12/schema",
  "$id": "dns-record-input-v1",
  "title": "DNS Record IBB - agnostic input contract",
  "type": "object",
  "required": ["request", "buildingBlock", "context", "requirements"],
  "additionalProperties": false,
  "properties": {
    "request": {
      "type": "object",
      "required": ["operation", "requestId"],
      "additionalProperties": false,
      "properties": {
        "operation": { "enum": ["validate", "create", "read", "upgrade", "delete"] },
        "requestId": { "type": "string", "pattern": "^req-[A-Za-z0-9._-]{4,}$" }
      }
    },
    "buildingBlock": {
      "type": "object",
      "required": ["name", "version"],
      "additionalProperties": false,
      "properties": {
        "name": { "const": "dns-record" },
        "version": { "type": "string", "pattern": "^\\d+\\.\\d+\\.\\d+$" }
      }
    },
    "context": {
      "type": "object",
      "required": [
        "applicationId",
        "environment",
        "platform",
        "costCenter",
        "dataClassification",
        "requesterIdentity",
        "correlationId"
      ],
      "additionalProperties": false,
      "properties": {
        "applicationId": { "type": "string", "pattern": "^APP-[0-9]{3,}$" },
        "environment": { "enum": ["dev", "qua", "tst", "ppr", "prd"] },
        "platform": { "enum": ["aws"] },
        "region": { "type": "string" },
        "costCenter": { "type": "string" },
        "dataClassification": { "enum": ["internal", "confidential"] },
        "requesterIdentity": {
          "type": "string",
          "description": "Authenticated caller identity (a non-human identity for automation) (CON-009)."
        },
        "correlationId": {
          "type": "string",
          "description": "End-to-end traceability across portal, orchestrator, pipeline, IaC, resource (CON-009, EVD-003)."
        },
        "changeReference": {
          "type": "string",
          "description": "Approved change record reference. Required by policy for prd (SBP AWS-005); enforced conditionally in the pipeline, not the schema."
        }
      }
    },
    "requirements": {
      "type": "object",
      "description": "Agnostic, capability-specific knobs, nested by the fixed high-level categories (sizing/access/resilience/security/operations) from requirement-dictionary/requirement-properties.yaml, per scaffold-ibb SKILL.md §1b. Do NOT put dataClassification here — it is a mandatory context field, already required above.",
      "required": ["operations"],
      "additionalProperties": false,
      "properties": {
        "operations": {
          "type": "object",
          "required": ["dnsZone", "recordName", "recordType", "ttlSeconds", "recordValues"],
          "additionalProperties": false,
          "properties": {
            "dnsZone": {
              "type": "string",
              "description": "The DNS zone the record belongs to, identified by its domain name (e.g. example.com.). Maps to the provider's hosted-zone/DNS-zone resource."
            },
            "recordName": {
              "type": "string",
              "description": "The record's name, relative to dnsZone (e.g. \"www\" for www.example.com.)."
            },
            "recordType": {
              "type": "string",
              "enum": ["A", "CNAME", "TXT"],
              "description": "DNS resource record type."
            },
            "ttlSeconds": {
              "type": "integer",
              "minimum": 1,
              "description": "Time-to-live, in seconds, for the record's cache lifetime."
            },
            "recordValues": {
              "type": "array",
              "items": { "type": "string" },
              "minItems": 1,
              "description": "The record's target value(s) — IP address(es) for A, a hostname for CNAME, or string content for TXT."
            }
          }
        }
      }
    }
  }
}
